{
  "$otSharedSchema": "#/pipette/schemas/2/pipetteLiquidPropertiesSchema.json",
  "supportedTips": {
    "t10": {
      "defaultAspirateFlowRate": {
        "default": 5,
        "valuesByApiLevel": { "2.0": 5 }
      },
      "defaultDispenseFlowRate": {
        "default": 10,
        "valuesByApiLevel": { "2.0": 10 }
      },
      "defaultBlowOutFlowRate": {
        "default": 1000,
        "valuesByApiLevel": { "2.0": 1000 }
      },
      "defaultTipLength": 33.0,
      "aspirate": {
        "default": {
          "1": [
            [0.8649, 0.0374, 0.8484],
            [1.2416, -0.0987, 0.9503],
            [1.6053, -0.069, 0.9134],
            [1.9851, -0.0226, 0.839],
            [2.3481, -0.0313, 0.8561],
            [2.7207, -0.0143, 0.8164],
            [3.0702, -0.028, 0.8536],
            [4.5998, -0.0006, 0.7694],
            [6.1063, -0.0022, 0.7769],
            [7.6504, 0.0011, 0.7564],
            [9.1863, 0.0003, 0.7626],
            [10.7574, 0.0018, 0.7488],
            [12.2984, -0.4986, 6.1321]
          ]
        }
      },
      "dispense": { "default": { "1": [[12.74444519, 0.0, 0.8058688085]] } },
      "defaultPushOutVolume": 0
    }
  },
  "maxVolume": 10,
  "minVolume": 1.0,
  "defaultTipracks": [
    "opentrons/opentrons_96_tiprack_10ul/1",
    "opentrons/opentrons_96_filtertiprack_10ul/1",
    "opentrons/geb_96_tiprack_10ul/1"
  ]
}
